{
  "version": 0,
  "publisher": "https://foo.com",
  "interestGroups": {
    "https://owner1.com": "<bytes>",
    "https://owner2.com": "<bytes>"
  },
  "generationId": "a8098c1a-f86e-11da-bd1a-00112444be1e",
  "enableDebugReporting": false,
  "requestTimestampMs": 1723102593791,
  "enforceKAnon": true
}
